{
  "$schema": "http://json-schema.org/draft-07/schema#",
  "$comment": "GENERATED by gui/schema-gen/derive_nf_config_schemas.py from config/nsacf.json + its source (ADR-0425). Do not edit; regenerate.",
  "title": "nsacf",
  "type": "object",
  "additionalProperties": false,
  "properties": {
    "port": {
      "type": "integer",
      "x-cpp-type": "unsigned short"
    },
    "advertised_ipv4": {
      "type": "string",
      "x-env-override": "NSACF_ADVERTISED_IPV4",
      "x-cpp-type": "std::string"
    },
    "sbi_bind_address": {
      "type": "string",
      "x-cpp-type": "std::string"
    },
    "metrics_bind_address": {
      "type": "string",
      "x-cpp-type": "std::string"
    },
    "nrf_base_url": {
      "type": "string",
      "x-env-override": "NSACF_NRF_BASE_URL",
      "x-cpp-type": "std::string"
    },
    "eac_activation_percent": {
      "type": "integer",
      "x-cpp-type": "std::int64_t"
    },
    "slices": {
      "type": "array",
      "items": {
        "type": "object",
        "additionalProperties": false,
        "properties": {
          "sst": {
            "type": "integer"
          },
          "sd": {
            "type": "string"
          },
          "max_ues": {
            "type": "integer"
          },
          "max_pdus": {
            "type": "integer"
          }
        }
      },
      "x-cpp-type": "json"
    },
    "oauth2_required": {
      "type": "boolean",
      "x-env-override": "NSACF_OAUTH2_REQUIRED",
      "x-cpp-type": "bool"
    }
  },
  "required": [
    "advertised_ipv4",
    "eac_activation_percent",
    "metrics_bind_address",
    "nrf_base_url",
    "port",
    "sbi_bind_address",
    "slices"
  ],
  "x-config-file": "config/nsacf.json",
  "x-source": [
    "nfs/nsacf"
  ],
  "x-apply": "restart",
  "x-review": [
    "slices[]: nested object shape inferred from current values (map-vs-struct meaning unverified; new keys refused until reviewed)"
  ]
}
