{
  "port": 7797,
  "advertised_ipv4": "127.0.0.1",
  "sbi_bind_address": "0.0.0.0",
  "metrics_bind_address": "0.0.0.0:9484",
  "nrf_base_url": "https://127.0.0.1:7777",
  "eac_activation_percent": 80,
  "slices": [
    {
      "sst": 1,
      "sd": "000001",
      "max_ues": 100,
      "max_pdus": 200
    },
    {
      "sst": 2,
      "max_ues": 10,
      "max_pdus": 20
    }
  ],
  "oauth2_required": true
}
